id,framework,language,link,description,popularity,dateAdded,images137,Brill,Java,http://planlodge.com/techconsume/no-website.html,"The Brill Framework is an open source framework for developing transactional web sites using Java and XHTML. The Brill Framework was developed by Chris Bulcock, as a result of becoming frustrated with frameworks such as Apache Struts, which depends on Java Server Pages. The objective was to develop a framework that is simple, that supports WYSIWYG page editing and does not require Java code or special tags within the Server Pages.",1,10/23/15,http://planlodge.com/techconsume/recipientimages/empty-avatar.jpg138,ztemplates,Java,http://www.ztemplates.org/,"ztemplates is a framework for creating web-applications based on Java 1.5. Features: * new and unique action processing module * clean, technology agnostic urls * fully JSP, Velocity and AJAX compatible * state-free * invisible to the web-client * convention over configuration * extensible * small and modular",1,10/23/15,http://planlodge.com/techconsume/recipientimages/empty-avatar.jpg139,Aranea Web,Java,http://planlodge.com/techconsume/no-website.html,"Aranea is an Open Source (APL 2.0) Java Hierarchical Model-View-Controller Web Framework that provides a common simple approach to building the web application components, reusing custom or general GUI logic and extending the framework. The framework enforces programming using Object-Oriented techniques with POJOs and provides a JSP tag library that facilitates programming web GUIs without writing HTML.",1,10/23/15,http://planlodge.com/techconsume/recipientimages/empty-avatar.jpg140,RSF,Java,http://www2.caret.cam.ac.uk/rsfwiki/,"RSF is an open source web programming framework, with roughly the scope of Sun's JSF. RSF is written in Java, and is built on the Spring framework. RSF features a pure-HTML templating engine named IKAT, which achieves the cleanest separation between presentation and logic yet made - build components using pure HTML and libraries of code rather than heavy framework base classes. RSF also features a lightweight request-scope Spring clone, RSAC, which brings the magic benefits of inversion of control into the request scope. RSF currently has integrations for Hibernate, JSR-168, Cocoon and Sakai.",1,10/23/15,http://planlodge.com/techconsume/recipientimages/empty-avatar.jpg141,Strecks,Java,http://strecks.sourceforge.net/,"Strecks is a set of extensions to the Struts web development framework aimed at Java 5 users. The aim of Strecks is to enhance the capability of Struts in terms of productivity and maintainability. Strecks makes use of Java 5 language features, in particular JSR-175 annotations, to simplify the programming model for Struts applications.",1,10/23/15,http://planlodge.com/techconsume/recipientimages/empty-avatar.jpg142,Aurora,Java,http://planlodge.com/techconsume/no-website.html,"Aurora is an open-source MVC framework that is aimed at writing configurable, fully object-oriented form controllers using the Spring Framework. The code-base grew out of my experience using Spring's MVC module and slowly developed over several versions into a full-fledged framework that attempts at tackling the most common problems that I had when using Spring MVC and other J2EE web-related issues in general.",1,10/23/15,http://planlodge.com/techconsume/recipientimages/empty-avatar.jpg143,ThinWire,Java,http://planlodge.com/techconsume/no-website.html,"ThinWire is a development framework that allows you to easily build applications for the web that look and feel like the desktop applications you're familiar with. Responsive, expressive & interactive user interfaces in your web browser without the complexity of the alternatives.",1,10/23/15,http://planlodge.com/techconsume/recipientimages/empty-avatar.jpg144,Roma Meta,Java,http://planlodge.com/techconsume/no-website.html,"Roma Meta Framework is a Open Source initiative to make Java application development easy. The approach is totally DDD, let's think to the domain of your application and Roma will makes the rest: persistence (database), presentation (HTML + Ajax), logging, user management, sessions, etc.",1,10/23/15,http://planlodge.com/techconsume/recipientimages/empty-avatar.jpg145,Pustefix,Java,http://pustefix-framework.org/,"Pustefix is a framework that helps you to develop web based applications. The framework consists of two more or less independent parts: A machinery to apply recursive XSLT transformations that produces the UI of the web application. A Java framework that takes input from the UI to change the application data and supplies changes of the application data back to the UI. Together, the framework acts similar to the Model-View-Controller pattern (as far as this is possible in the context of a web application).",1,10/23/15,http://planlodge.com/techconsume/recipientimages/empty-avatar.jpg146,jWic,Java,https://github.com/xwic/jWic,"jWic is a java-based development framework for developing dynamic web applications with the convenience and familiarity of 'rich client' style programming. The component-based, event-driven programming model makes it easy for developers to quickly create flexible and robust web applications. The collection of standard jWic controls has built-in Ajax functionality to enhance the end-user experience. Developers can also implement their own jWic controls and combine and incorporate them into their web applications.",1,10/23/15,http://planlodge.com/techconsume/recipientimages/empty-avatar.jpg147,Calyxo,Java,http://planlodge.com/techconsume/no-website.html,"The Calyxo framework encourages in MVC model 2 based web application development. It offers support for true modular applications, i18n, a flexible view manager, a powerful validation engine, and more.",1,10/23/15,http://planlodge.com/techconsume/recipientimages/empty-avatar.jpg148,Mentawai,Java,http://www.mentaframework.org/Page.mtw,"The Mentawai goal is to be a simple, flexible, joyful and productive Java web framework. * Simple: Mentawai is very simple to install, configure and understand. * Flexible: The Mentawai architecture is very flexible and well organized, enabling any mortal to create new functionalities to the framework by implementing its core classes. The core of the framework is all based on interfaces. * Complete: Mentawai offers transparent solutions for the repetitive tasks of every web project. * Joyful: Mentawai offers programatic configuration with 100% pure Java code. * Productive: Mentawai offers simple and practical solutions to most of the web development problems, reducing the developing time.",1,10/23/15,http://planlodge.com/techconsume/recipientimages/empty-avatar.jpg149,Trimpath Junction,Java,https://code.google.com/p/trimpath/,"TrimPath provides open-source (GPL & APL) web technologies, focused around JavaScript, synchronization, MVC, occasionally connected computing, and Google Gears. The open source Junction framework is a conventions-over-configuration, synchronizing web MVC framework for JavaScript. Features of Junction: * Junction is a riff of the Ruby on Rails framework into the world of JavaScript. * Junction makes your web application perform great. * Junction is a synchronizing MVC framework for building applications on top of Google Gears, but also does not require Google Gears if you don't want it. * Junction automatically synchronizes your client-side and server-side code and RDBMS's. * Junction still works even if the network is occasionally-connected or offline. * Junction can run your application in the web-browser or on a Rhino-based server, or both. It's your choice. And, you write your application code just once to support these different runtime options. No duplicate logic.",1,10/23/15,http://planlodge.com/techconsume/recipientimages/empty-avatar.jpg150,Makumba,Java,http://www.makumba.org/,"Makumba is a query-centric MVC web framework designed to build database-driven without advanced knowledge of database systems or Java. It is simple to configure and eliminates all the overhead usually needed to get data from the database to the view. Its intuitive tag-library helps building complex sites in much less time than other frameworks. Its main features are: * Makumba List engine (using OQL/HQL as query language), to \"loop\" over records in the database and display them correctly according to their data type. * Makumba Forms, supporting nested forms and making it possible to build complex forms without having to worry about how the data will get stored. * Makumba Data Definitions (MDDs), an abstraction of the data model, making the model design very easy.""akumba is a query-centric MVC web framework designed to build database-driven without advanced knowledge of database systems or Java. It is simple to configure and eliminates all the overhead usually needed to get data from the database to the view. Its intuitive tag-library helps building complex sites in much less time than other framework",1,10/23/15,http://planlodge.com/techconsume/recipientimages/empty-avatar.jpg151,AribaWeb,Java,http://aribaweb.org/,"AribaWeb is the Open Source component-based web application development framework for creating rich, AJAX-enabled applications with the absolute minimum of code (and no hand-coded Javascript). Discover the difference that sets AribaWeb apart: Auto AJAX, Instant App, Live Edit & X-Ray,Proven Full Stack.",1,10/23/15,http://planlodge.com/techconsume/recipientimages/empty-avatar.jpg152,fleXive,Java,http://www.flexive.org/,"A Java EE 5 open-source framework for the development of complex and evolving (web-)applications. It speeds up development by easing many tedious and repetitive programming tasks and helping to keep your application(s) flexible during the development-cycle and in production. [fleXive] concentrates on enterprise-scale content modeling, storage and retrieval, and includes comprehensive JSF support for displaying and manipulating these contents in (web) applications. The runtime environment can be included in existing Java EE applications, but you can also build new applications and package them into stand-alone Java EE applications. [fleXive] provides essential features for data-centric applications: * Secure EJB-based persistence engine * Web development JSF toolkit * Powerful administration interfaces * Based on the latest industry-standards like Java 6, EJB 3, JSF, etc.",1,10/23/15,http://planlodge.com/techconsume/recipientimages/empty-avatar.jpg153,Flower,Java,https://code.google.com/p/spring-flower/,A minimalistic framework that helps you in converting your Spring beans into HTTP-accessible controllers using one servlet and a few additional lines in your XML application context. This framework uses Extensible XML authoring feature available in Spring and allows you to expose the bean using just one additional XML attribute on your bean.,1,10/23/15,http://planlodge.com/techconsume/recipientimages/empty-avatar.jpg154,Hamlets,Java,http://hamlets.sourceforge.net/,"Hamlets (previously known as IBM Servlet-based Content Creation Framework) is an open source system for generating dynamic web-pages originally developed by Ren? Pawlitzek at IBM. A Hamlet is a servlet extension that reads XHTML template files containing presentation using SAX (the Simple API for XML) and dynamically adds content on the fly to those places in the template which are marked with special tags and IDs using a small set of callback functions. A template compiler can be used to accerate Hamlets. Hamlets provide an easy-to-use, easy-to-understand, lightweight, small-footprint, servlet-based content creation framework that facilitates the development of Web-based applications. The Hamlets framework not only supports but also enforces the complete separation of content and presentation.",1,10/23/15,http://planlodge.com/techconsume/recipientimages/empty-avatar.jpg155,Induction,Java,http://www.inductionframework.org/index.html,"Induction is a powerful, high performance, Java MVC web application framework. Induction supports dynamic application reloading, type-based dependency injection and dependency analysis between models, views and controllers. The goal of Induction is to simplify the task of building complex, high performance, maintainable web applications using Java technology.",1,10/23/15,http://planlodge.com/techconsume/recipientimages/empty-avatar.jpg156,JVx,Java,http://www.sibvisions.com/jvx,"The JVx Framework (or JVx - Enterprise Application Framework) is a Full-Stack Application Framework for the Java platform. JVx facilitates the development of professional and efficient Database applications, in a short time and using little source code. The framework's architecture is based on the Multi-tier architecture model for the development of software systems. Building on a three-tier architecture and following the Dependency inversion principle JVx allows for easy development of efficiently maintained applications. The framework provides full support for all tiers. Because of the Single Sourcing principle, the application is coded once and used with different technologies (RIA, HTML/Ajax, Desktop).",1,10/23/15,http://planlodge.com/techconsume/recipientimages/empty-avatar.jpg157,jZeno,Java,http://jzeno.org/,"jZeno is an open source java development framework that offers the ability to develop rich web applications. The main architectural goal of jZeno is to allow people to create web applications using pure java development as much as possible. Largely reducing the need to know technologies like javascript, HTML, CSS, database specific SQL, JSP, JSF, etc..",1,10/23/15,http://planlodge.com/techconsume/recipientimages/empty-avatar.jpg158,Pandora,Java,http://planlodge.com/techconsume/no-website.html,"Pandora is an easy to use, fast and lightweight framework for creating web applications with Java. Pandora uses Velocity for templating and provides support for Hibernate as persistence layer. It has great support for handling formular input with validators etc. and for lists, tables and trees (filtering, sorting, searching for free).",1,10/23/15,http://planlodge.com/techconsume/recipientimages/empty-avatar.jpg159,Playframework,Java,http://java-source.net/open-source/web-frameworks/playframework,"The Play framework makes it easier to build Web applications with Java: Quick overview * Fix the bug and hit reload! Edit your Java files, save, refresh your browser and see the results immediately! No need to compile, deploy or restart the server. * Stateless model Play is a real Share nothing system. Ready for REST, it is easily scaled by running multiple instances of the same application on several servers. * Efficient template system A clean template system based on Groovy as an expression language. It provides template inheritence, includes and tags. * Resolve errors quickly When an error occurs, play shows you the source code and the exact line containing the problem. Even in templates. * All you need to create a cool web application Provides integration with Hibernate, OpenID, Memcached... And a plugin system. * Pure Java Code with Java, use any Java library and develop with your preferred IDE. Integrates nicely with eclipse or netbeans. * Really fast Starts fast and runs fast!",1,10/23/15,http://planlodge.com/techconsume/recipientimages/empty-avatar.jpg160,SerfJ,Java,http://serfj.sourceforge.net/,"SerfJ is the easiest way of developing Java REST web applications. It helps you to develop your application over an elegant MVC arquitecture, giving more importance to convention than configuration, so for example, you will not have to have configuration files or annotations in order to specify which view serves a controller's method. However, SerfJ is very flexible, so if you want to jump over those conventions, you can configure the behaviour of your applications as you like.",1,10/23/15,http://planlodge.com/techconsume/recipientimages/empty-avatar.jpg161,Sombrero,Java,http://planlodge.com/techconsume/no-website.html,An AJAX framework to write database web applications with the target to edit and show the stored informations in different form windows. For this a simulated MDI-GUI gives the user the possibility to jumb between the form windows opened by himself. Tables has horizontal und vertical scrollbars. Between the server and the browser of the user the traffic is very small also in the case of very large tables because only the visible rows are transfered with AJAX. The tutorial is currently in german language but the API documentation is in english.,1,10/23/15,http://planlodge.com/techconsume/recipientimages/empty-avatar.jpg162,Vaadin,Java,https://vaadin.com/home,"Vaadin is a web application framework for Rich Internet Applications (RIA). In contrast to Javascript libraries and browser-plugin based solutions, it features a server-side architecture, which means that the largest part of the logic runs on the server. Ajax technology is used on the browser side to ensure a rich and interactive user experience. Developers compose the application user interface from components such as the Button, Table and Tree. The components use events, listeners and data binding to communicate with each other and with business logic. The component-based architecture together with the data binding features help building applications that are easily modularized and refactored as needed.",1,10/23/15,http://planlodge.com/techconsume/recipientimages/empty-avatar.jpg163,Vroom,Java,http://sourceforge.net/projects/vroom/,"Vroom is a framework for HTML/JSP and Java code binding. It's extremely simple to use and very powerful. It can control your HTML widgets on the fly. It can be applied independently as JSP/Servlet Model or can be integrated with Struts, JSF, YUI etc. No custom tags, no complex configurations, just simple binding configuration file and backing beans.",1,10/23/15,http://planlodge.com/techconsume/recipientimages/empty-avatar.jpg164,wro4j,Java,https://github.com/wro4j/wro4j,"Free and Open Source Java project which brings together almost all the modern web tools: JsHint, CssLint, JsMin, Google Closure compressor, YUI Compressor, UglifyJs, Dojo Shrinksafe, Css Variables Support, JSON Compression, Less, Sass, CoffeeScript and much more. In the same time, the aim is to keep it as simple as possible and as extensible as possible in order to be easily adapted to application specific needs.",1,10/23/15,http://planlodge.com/techconsume/recipientimages/empty-avatar.jpg165,Flight,Javascript,https://flightjs.github.io/,"Flight is a lightweight, component-based JavaScript framework that maps behavior to DOM nodes. Twitter uses it for their web applications.",1,10/23/15,http://planlodge.com/techconsume/recipientimages/empty-avatar.jpg166,Aurelia,Javascript,http://aurelia.io/,"Aurelia is a next gen JavaScript client framework for mobile, desktop and web that leverages simple conventions to empower your creativity.",1,10/23/15,http://planlodge.com/techconsume/recipientimages/empty-avatar.jpg167,Enyo,Javascript,http://enyojs.com/,A framework for building native-quality HTML5 apps that run everywhere ,1,10/23/15,http://planlodge.com/techconsume/recipientimages/empty-avatar.jpg168,Kango,Javascript,http://kangoextensions.com/,Create extensions for browsers in minutes using JavaScript only!,1,10/23/15,http://planlodge.com/techconsume/recipientimages/empty-avatar.jpg169,Durandal,Javascript,http://durandaljs.com/,"Durandal is built on libs you know and love like jQuery, Knockout and RequireJS. There's little to learn and building apps feels comfortable and familiar. Dive in and enjoy.",1,10/23/15,http://planlodge.com/techconsume/recipientimages/empty-avatar.jpg171,Webix,Javascript,http://webix.com/,"Whether you?re a beginner or an advanced JavaScript developer, Webix is an easy to learn javascript framework that has a well-documented and coherent API with similar principles for various UI widgets.",1,10/23/15,http://planlodge.com/techconsume/recipientimages/empty-avatar.jpg172,Polymer,Javascript,https://www.polymer-project.org/1.0/,"Polymer 1.0 has been rebuilt from the ground up for speed and efficiency. The new, leaner core library makes it easier than ever to make fast, beautiful, and interoperable web components. If you haven't used Polymer before, it's time to try it out. If you haven't tried it recently, time to take another look.",1,10/23/15,http://planlodge.com/techconsume/recipientimages/empty-avatar.jpg173,Matreshka,Javascript,http://matreshka.io/,"Matreshka is a framework for massive and endlessly extending single page applications (within the Universe, of course), written in JavaScript. It allows you to build program architecture so that neither your team nor you can get confused in plentiful entities, logic described in HTML files, numerous restrictions of other frameworks and incomprehensible abstractions.",1,10/23/15,http://planlodge.com/techconsume/recipientimages/empty-avatar.jpg174,Socket.IO,Javascript,http://socket.io/,"Socket.IO enables real-time bidirectional event-based communication. It works on every platform, browser or device, focusing equally on reliability and speed. ",1,10/23/15,http://planlodge.com/techconsume/recipientimages/empty-avatar.jpg175,Meteor,Javascript,https://www.meteor.com/,Full stack JavaScript for amazing apps,1,10/23/15,http://planlodge.com/techconsume/recipientimages/empty-avatar.jpg177,The Opa Language,Javascript,http://opalang.org/,"Write simultaneously the frontend and backend code, in the same language, within the same module. Even better: the Opa Slicer automates the calls between client and server. No more manually written AJAX calls or value serialization!",1,10/23/15,http://planlodge.com/techconsume/recipientimages/empty-avatar.jpg178,Vanilla JS,Javascript,http://vanilla-js.com/,"Vanilla JS is a fast, lightweight, cross-platform framework for building incredible, powerful JavaScript applications.",1,10/23/15,http://planlodge.com/techconsume/recipientimages/empty-avatar.jpg179,MEAN,Javascript,http://meanjs.org/,"MEAN.JS is a full-stack JavaScript solution that helps you build fast, robust, and maintainable production web applications using MongoDB, Express, AngularJS, and Node.js.",1,10/23/15,http://planlodge.com/techconsume/recipientimages/empty-avatar.jpg180,Ample,Javascript,http://www.amplesdk.com/,Ample SDK is entirely written in JavaScript and thus it does not require any specific components installed in the browser to operate properly. It doesn't modify the browser infrastructure but rather fills in the missing functionality.,1,10/23/15,http://planlodge.com/techconsume/recipientimages/empty-avatar.jpg181,Flatiron,Javascript,http://flatironjs.org/,Flatiron is an adaptable framework for building modern web applications. It was built from the ground up for use with JavaScript and Node.js.,1,10/23/15,http://planlodge.com/techconsume/recipientimages/empty-avatar.jpg182,P,Javascript,https://www.npmjs.com/package/p-framework,"The P Framework is a real time web framework written in Node.js. It utilizes modern HTML5 technology, including WebSockets to provide a fast, sleek web app experience.",1,10/23/15,http://planlodge.com/techconsume/recipientimages/empty-avatar.jpg183,ScaleApp,Javascript,http://scaleapp.org/,ScaleApp is a tiny JavaScript framework for scalable and maintainable One-Page-Applications / Single-Page-Applications. The framework allows you to easily create complex web applications.,1,10/23/15,http://planlodge.com/techconsume/recipientimages/empty-avatar.jpg185,RightJS,Javascript,http://rightjs.org/,"RightJS is a modular JavaScript framework. It has a very skiny (15k gzipped) core that has all the standard features, like dom-manipulation, animation, forms, cookies, events handling and so on.",1,10/23/15,http://planlodge.com/techconsume/recipientimages/empty-avatar.jpg186,Ripple.JS,Javascript,http://ripplejs.github.io/,"A tiny foundation for creating reactive components with interpolation, data-binding, and plugins. It's simple, flexible and easy to extend.",1,10/23/15,http://planlodge.com/techconsume/recipientimages/empty-avatar.jpg187,Sails.JS,Javascript,http://sailsjs.org/,"Sails makes it easy to build custom, enterprise-grade Node.js apps. It is designed to emulate the familiar MVC pattern of frameworks like Ruby on Rails, but with support for the requirements of modern apps: data-driven APIs with a scalable, service-oriented architecture.",1,10/23/15,http://planlodge.com/techconsume/recipientimages/empty-avatar.jpg188,Midori,Javascript,http://www.midorijs.com/,Midori is an ultra-lightweight JavaScript framework that gets the job done without getting in your way.,1,10/23/15,http://planlodge.com/techconsume/recipientimages/empty-avatar.jpg189,Stapes.JS,Javascript,https://hay.github.io/stapes/,"Stapes.js is designed to be agnostic about your setup and style of coding. Like to code using models, views and controllers? Or just with modules? Use jQuery? Zepto? React? Rivets? Whatever you fancy, Stapes gives you the necessary building blocks to build a kick-ass app.",1,10/23/15,http://planlodge.com/techconsume/recipientimages/empty-avatar.jpg190,Dojo Toolkit,Javascript,https://dojotoolkit.org/,"A JavaScript toolkit that saves you time and scales with your development process. Provides everything you need to build a Web app. Language utilities, UI components, and more, all in one place, designed to work together perfectly.",1,10/23/15,http://planlodge.com/techconsume/recipientimages/empty-avatar.jpg191,MochiKit,Javascript,https://mochi.github.io/mochikit/,"MochiKit is a highly documented and well tested, suite of JavaScript libraries that will help you get shit done, fast. We took all the good ideas we could find from our Python, Objective-C, etc. experience and adapted it to the crazy world of JavaScript.",1,10/23/15,http://planlodge.com/techconsume/recipientimages/empty-avatar.jpg