id,framework,language,link,description,popularity,dateAdded,images80,Zend Framework,PHP,http://framework.zend.com/,"Zend Framework 2 is an open source framework for developing web applications and services using PHP 5.3+. Zend Framework 2 uses 100% object-oriented code and utilises most of the new features of PHP 5.3, namely namespaces, late static binding, lambda functions and closures.",1,10/23/15,http://planlodge.com/techconsume/recipientimages/empty-avatar.jpg81,Zikula,PHP,http://zikula.org/,"Zikula is an OpenSource PHP Application Framework, for your small to enterprise business or personal site.",1,10/23/15,http://planlodge.com/techconsume/recipientimages/empty-avatar.jpg82,Sinatra,Ruby,http://www.sinatrarb.com/,"Designed and developed by Blake Mizerany, Sinatra is small and flexible. It does not follow the typical?model?view?controller?pattern used in other frameworks, such as Ruby on Rails. Instead, Sinatra focuses on quickly creating web-applications in Ruby with minimal effort.",1,10/23/15,http://planlodge.com/techconsume/recipientimages/empty-avatar.jpg83,Ramaze,Ruby,http://ramaze.net/,"Ramaze is a very simple and straight-forward web-framework. The philosophy of it could be expressed in a mix of KISS and POLS, trying to make simple things simple and complex things possible and fun.",1,10/23/15,http://planlodge.com/techconsume/recipientimages/empty-avatar.jpg84,Padrino,Ruby,http://www.padrinorb.com/,Padrino is a ruby framework built upon the Sinatra web library. Sinatra is a?DSL?for creating simple web applications in Ruby. Padrino was created to make it fun and easy to code more advanced web applications while still adhering to the spirit that makes Sinatra great!,1,10/23/15,http://planlodge.com/techconsume/recipientimages/empty-avatar.jpg85,NYNY,Ruby,https://github.com/alisnic/nyny,"NYNY is unassuming, it has all the core stuff to get running, but nothing else. Your app is the framework. However, it's trivial to extend NYNY via its?extension interface.",1,10/23/15,http://planlodge.com/techconsume/recipientimages/empty-avatar.jpg86,Nancy,Ruby,https://github.com/guilleiguaran/nancy,Minimal Ruby microframework for web development inspired in?Sinatra?and?Cuba,1,10/23/15,http://planlodge.com/techconsume/recipientimages/empty-avatar.jpg87,Grape,Ruby,http://intridea.github.io/grape/,Grape is a?REST-like API?micro-framework for Ruby. It's designed to run on Rack or complement existing?web application frameworks?such as Rails and?Sinatra?by providing a simple?DSL?to easily develop RESTful APIs.,1,10/23/15,http://planlodge.com/techconsume/recipientimages/empty-avatar.jpg88,Cuba,Ruby,http://cuba.is/,"Cuba is a microframework for web development originally inspired by?Rum, a tiny but powerful mapper for?Rack?applications.",1,10/23/15,http://planlodge.com/techconsume/recipientimages/empty-avatar.jpg89,Camping,Ruby,http://camping.io/,"Camping is a small web framework, less than 4k, a little white blood cell in the vein of Rails.",1,10/23/15,http://planlodge.com/techconsume/recipientimages/empty-avatar.jpg90,Ruby on Rails,Ruby,http://rubyonrails.org/,Ruby on Rails is an open-source web framework that?s optimized for programmer happiness and sustainable productivity. It lets you write beautiful code by favoring convention over configuration.,1,10/23/15,http://planlodge.com/techconsume/recipientimages/empty-avatar.jpg91,Kenji,Ruby,https://github.com/kballenegger/kenji,"Kenji believes that a traditional web application should be divided into two parts: an client application running in the browser (HTML/JS/CSS), and a backend API with which it communicates. Kenji is the backend side of the equation, while the front-end architecture is left up to the user. (Popular options are?backbone?and?spine.",1,10/23/15,http://planlodge.com/techconsume/recipientimages/empty-avatar.jpg92,Brooklyn,Ruby,https://github.com/luislavena/brooklyn,Small web tool on top of Rack,1,10/23/15,http://planlodge.com/techconsume/recipientimages/empty-avatar.jpg93,Spring MVC,Java,https://spring.io/,"Write clean, testable code against the infrastructure components of your choice and accomplish any task ? without re-inventing the wheel.",1,10/23/15,http://planlodge.com/techconsume/recipientimages/empty-avatar.jpg94,JSF,Java,http://www.javaserverfaces.org/,"JSF is included in the Java EE platform, so you can create applications that use JSF without adding any extra libraries in your project. JSF works equally as well as a standalone web framework, able to hook into bean containers such as Spring.",1,10/23/15,http://planlodge.com/techconsume/recipientimages/empty-avatar.jpg95,Vaadin,Java,https://vaadin.com/home,"Vaadin Framework lets you build single page web apps in server-side Java or any other JVM language. All of the browser?server communication and DTOs are automated for you. Your app's state resides on the server, but your end-users use an HTML5 web app in their browsers.",1,10/23/15,http://planlodge.com/techconsume/recipientimages/empty-avatar.jpg96,Grails,Java,https://grails.org/,"Grails is a powerful web framework, for the Java platform aimed at multiplying developers? productivity thanks to a Convention-over-Configuration, sensible defaults and opinionated APIs. It integrates smoothly with the JVM, allowing you to be immediately productive whilst providing powerful features, including integrated ORM, Domain-Specific Languages, runtime and compile-time meta-programming and Asynchronous programming.",1,10/23/15,http://planlodge.com/techconsume/recipientimages/empty-avatar.jpg97,Play,"Java, Scala",https://www.playframework.com/,"Play is based on a lightweight, stateless, web-friendly architecture.",1,10/23/15,http://planlodge.com/techconsume/recipientimages/empty-avatar.jpg98,Struts,Java,https://struts.apache.org/,"Apache Struts is a free, open-source, MVC framework for creating elegant, modern Java web applications. It favors convention over configuration, is extensible using a plugin architecture, and ships with plugins to support REST, AJAX and JSON.",1,10/23/15,http://planlodge.com/techconsume/recipientimages/empty-avatar.jpg99,Spark,Java,http://sparkjava.com/,A tiny Sinatra inspired framework for creating web applications in Java 8 with minimal effort,1,10/23/15,http://planlodge.com/techconsume/recipientimages/empty-avatar.jpg100,Netty,Java,http://netty.io/,Netty is a NIO client server framework which enables quick and easy development of network applications such as protocol servers and clients. It greatly simplifies and streamlines network programming such as TCP and UDP socket server.,1,10/23/15,http://planlodge.com/techconsume/recipientimages/empty-avatar.jpg101,Seam,Java,http://seamframework.org/,"Seam is a powerful open source development platform for building rich Internet applications in Java. Seam integrates technologies such as Asynchronous JavaScript and XML (AJAX), JavaServer Faces (JSF), Java Persistence (JPA), Enterprise Java Beans (EJB 3.0) and Business Process Management (BPM) into a unified full-stack solution.",1,10/23/15,http://planlodge.com/techconsume/recipientimages/empty-avatar.jpg102,Sitemesh,Java,http://wiki.sitemesh.org/wiki/display/sitemesh/Home,SiteMesh is a lightweight and flexible Java web application framework that applies the Gang of Four decorator pattern to allow a clean separation of content from presentation.,1,10/23/15,http://planlodge.com/techconsume/recipientimages/empty-avatar.jpg103,Wicket,Java,http://wicket.apache.org/,"This framework allows Java developers to write web applications using components. This way developers can reason about the user interface in user interface building blocks, making it easier to link specific user interactions to server-side code. Wicket is a high performance framework processing billions of requests daily across the world.",1,10/23/15,http://planlodge.com/techconsume/recipientimages/empty-avatar.jpg104,VRaptor,Java,http://www.vraptor.org/,VRaptor 4 delivers high productivity to your Java Web applications on top of CDI. VRaptor is an opensource MVC framework with a large developers and users community.,1,10/23/15,http://planlodge.com/techconsume/recipientimages/empty-avatar.jpg105,Scalatra,Scala,http://scalatra.org/,"Combines the power of the JVM with the beauty and brevity of Scala, helping you quickly build high-performance web sites and APIs.",1,10/23/15,http://planlodge.com/techconsume/recipientimages/empty-avatar.jpg106,Turbine,Java,https://turbine.apache.org/,Apache Turbine is a servlet based framework that allows experienced Java developers to quickly build web applications. Turbine allows you to use personalize the web sites and to use user logins to restrict access to parts of your application.,1,10/23/15,http://planlodge.com/techconsume/recipientimages/empty-avatar.jpg107,WebWork,Java,https://struts.apache.org/,"WebWork was a Java-based web application framework developed by OpenSymphony that merged into the current Struts2 framework. It was designed to improve developer productivity and simplify code. WebWork was built on top of XWork, which provided a generic command pattern framework as well as an Inversion of Control container.",1,10/23/15,http://planlodge.com/techconsume/recipientimages/empty-avatar.jpg108,Cocoon,Java,https://cocoon.apache.org/2.1/,"Apache Cocoon is a web development framework built around the concepts of separation of concerns (making sure people can interact and collaborate on a project, without stepping on each other toes) and component-based web development.",1,10/23/15,http://planlodge.com/techconsume/recipientimages/empty-avatar.jpg109,Maverick,Java,http://mav.sourceforge.net/,"Maverick is a Model-View-Controller framework for web publishing using Java and J2EE. It is a minimalist framework which focuses solely on MVC logic, allowing you to generate presentation using a variety of templating and transformation technologies.",1,10/23/15,http://planlodge.com/techconsume/recipientimages/empty-avatar.jpg110,Echo,Java,http://echo.nextapp.com/site/,"cho is an open-source framework for developing rich web applications. From the developer's perspective, Echo behaves as a user interface toolkit--like Swing or Eclipse SWT. AJAX technology is employed to deliver a user experience to web clients that approaches that of desktop-based applications. Echo applications can be created entirely in server-side Java code using a component-oriented and event-driven API.",1,10/23/15,http://planlodge.com/techconsume/recipientimages/empty-avatar.jpg111,SOFIA,Java,http://sourceforge.net/projects/salmon/,"SOFIA is the Salmon Open Framework for Internet Applications. Conceptually, SOFIA is similar to other J2EE MVC open source frameworks, like Apache Struts. But SOFIA sets a new standard for Java development by delivering so much more in a framework matching best-of-breed tools integration with robust JSP class and tag libraries.",1,10/23/15,http://planlodge.com/techconsume/recipientimages/empty-avatar.jpg112,Verge,Java,http://planlodge.com/techconsume/no-website.html,The Verge Framework is an open source J2EE application framework written entirely in Java using only the standard J2EE APIs. This project aims to develop and promote a highly flexible and extensible framework for building enterprise applications.,1,10/23/15,http://planlodge.com/techconsume/recipientimages/empty-avatar.jpg113,Anvil,"Java, Ruby",http://anvil.rubyforge.org/,Anvil is an open source web development platform that contains a rich object-oriented programming language with functional features including tag-based template language. Performance is compararable to JSP as all the code is compiled directly to Java bytecode. Anvil apps are deployable as a servlet or standalone.,1,10/23/15,http://planlodge.com/techconsume/recipientimages/empty-avatar.jpg114,Jaffa,Java,http://jaffa.sourceforge.net/,"JAFFA is a Java/Javascript web application development stack, build around Web 2.0 technologies (ExtJS, DWR, JAWR) with an extensive service architecture, meta-data layer and rules engine (based on JBoss AOP and Drools). It provides an event driven SOA infrastructure with advanced scheduling, queuing and form generation sub-systems.",1,10/23/15,http://planlodge.com/techconsume/recipientimages/empty-avatar.jpg115,Japple,Java,http://planlodge.com/techconsume/no-website.html,"Japple is a rapid application development environment for building web applications and services. Built on the JavaTM2 Platform and open-standards, Japple allows you to develop and deploy web applications faster, easier and more efficiently than traditional methods.",1,10/23/15,http://planlodge.com/techconsume/recipientimages/empty-avatar.jpg116,Jpublish,Java,https://github.com/florinpatrascu/jpublish,"JPublish is a powerful web publishing system designed to ensure a clean separation of developer roles. JPublish includes support for multiple templating engines, including Jakarta Apache's Velocity, FreeMarker and WebMacro. JPublish supports numerous scripting languages including Python, BeanShell, and JavaScript. JPublish is modular and provides for easy extensibility.",1,10/23/15,http://planlodge.com/techconsume/recipientimages/empty-avatar.jpg117,Jucas,Java,http://jucas.sourceforge.net/,Jucas is a web-framework which brings together the pull MVC concept with component orientated design GUI programming.,1,10/23/15,http://planlodge.com/techconsume/recipientimages/empty-avatar.jpg118,MyFaces,Java,http://myfaces.apache.org/,"MyFaces is an implementation of JavaServer(tm) Faces (JSR 127), a new and upcoming web application framework that accomplishes the MVC paradigm. It is comparable to the well-known Struts Framework but has features and concepts that are beyond those of Struts.",1,10/23/15,http://planlodge.com/techconsume/recipientimages/empty-avatar.jpg119,WebOnSwing,Java,http://webonswing.sourceforge.net/,"WebOnSwing is a revolutionary multiple environment application framework that allows you to create web applications in the same way you develope a desktop one. You dont need to use JSP files, special tags, XML files, requests, posts, etc. Everything is Java and pure HTML files that comes directly from the graphic designer. This framework constructs and handles html pages with Swing components, allowing to use MVC architecture and all the facilities provided by Swing in the web.",1,10/23/15,http://planlodge.com/techconsume/recipientimages/empty-avatar.jpg120,Chrysalis,Java,http://chrysalis.sourceforge.net/,Chrysalis is a Java web development framework. It has a different focus from most Model-View-Controller (MVC) web frameworks. Chrysalis controllers resemble normal Java classes with multiple methods. Client request URLs are mapped to each controller method.,1,10/23/15,http://planlodge.com/techconsume/recipientimages/empty-avatar.jpg121,Millstone,Java,http://www.vraptor.org/,"VRaptor is a MVC web framework. It is highly based on the Inversion of Control principles, using constructor injection to decouple your components from your business logic classes.",1,10/23/15,http://planlodge.com/techconsume/recipientimages/empty-avatar.jpg122,SwingWeb,Java,http://swingweb.sourceforge.net/swingweb/,"Swingweb is an implementation of AWT toolkit that enables AWT/Swing application to be operating inside a web container and presented as a web application to the web browser, purely in HTML/CSS/javascript. There's no code conversion required for the swing application to run in the SwingWeb environment. Some of the features of SwingWeb include the following: * Support web-environment with multiple concurrent application sessions * Component-oriented architecture that allows developer to enable existing swing component to web environment easily * Support common AWT/Swing components in java.awt.* and javax.swing.* * Support all component layouts in jdk * Highly configurable use of jxp template for component presentation",1,10/23/15,http://planlodge.com/techconsume/recipientimages/empty-avatar.jpg123,Macaw,Java,http://planlodge.com/techconsume/no-website.html,"Macaw is an object-publishing framework designed for local web applications. Freemarker is used for presentation, Jetty is used as the default web container, and there is a basic integration with Hibernate (but other persistence mechanisms can be used). The framework requires two layers over the top of business logic classes: a Java web layer where certain simple method and class naming conventions are used to facilitate easy mapping of data to and from HTML, and Freemarker page templates. A small number of Freemarker tags are defined to enable references to Macaw-based objects within the page templates.",1,10/23/15,http://planlodge.com/techconsume/recipientimages/empty-avatar.jpg124,Barracuda,Java,http://barracudamvc.org/docs/index.html,"Barracuda is an open-source Presentation Framework designed to make it easier to build servlet based webapps by applying proven client-server patterns to the web development paradigm. It features a DOM based templating mechanism for better separation of code from content (default XMLC), a UI component model that provides a series of server side widgets (table, list, template, etc) that make it easy to manipulate DOM structures, and a strongly typed MVC interfaces just like in Swing. With support for multiple markup languages (HTML, WML, XML, etc). It has an event model that provides Model 2 style flow control and allows for true event driven programming on the server. You can add listeners to components and your server-side event handler code will automatically get notified when an action occurs on the client.",1,10/23/15,http://planlodge.com/techconsume/recipientimages/empty-avatar.jpg125,RIFE,Java,http://planlodge.com/techconsume/no-website.html,"RIFE offers an alternative approach to web application development and design. It builds upon the Java platform, but offers all required tools and APIs to implement and perform all common website related tasks in a fast, intuitive and consistent manner. RIFE has been designed for perfect separation of tasks during a development cycle. Every developer, dba and designer only has to focus on his own tasks. At any moment the work can be effortlessly integrated with the work of the rest of the team. This results in a loosely coupled and very robust system. One can make incremental improvements with little or no risk of unwanted side-effects elsewhere in the system. RIFE is composed out of a large collection of modular parts, which include: * web application engine, * integrated web continuations, * customizable multi-format template engine (html, xml, sql, java, txt, ...) * support for template content transforming through for example XSLT, * authentication framework, * database query builders, * simple persistance layer, * fault-tolerant JDBC wrappers and connection pooling, * web-oriented database utilities, * central data repository, * cron-like scheduler, * configuration framework. The central part is the engine which formalizes all aspects of dynamic web development. It graciously solves all doubt, confusion and maintenance problems of HTTP's statelessness and liberal CGI interface.",1,10/23/15,http://planlodge.com/techconsume/recipientimages/empty-avatar.jpg126,DWR,Java,http://planlodge.com/techconsume/no-website.html,DWR is AJAX and XMLHttpRequest made easy. It makes it simple to call Java on the server directly from Javascript in the browser marshalling all the parameters and return values. It gets rid of almost all the boiler plate code between the web browser and your Java code. interaction diagram DWR helps you in producing highly interactive web-sites by providing some Javascript libraries to help with DHTML and by giving you a set of examples to copy from.,1,10/23/15,http://planlodge.com/techconsume/recipientimages/empty-avatar.jpg127,JSPWidget,Java,http://planlodge.com/techconsume/no-website.html,"JSPWidget is a JSP Framework that provides event-driven,view state retained,server-side GUI controls to make JSP development as intuitive as in traditional client forms or in client-based Web applications.",1,10/23/15,http://planlodge.com/techconsume/recipientimages/empty-avatar.jpg128,JOSSO,Java,http://www.josso.org/confluence/display/JOSSO1/JOSSO+-+Java+Open+Single+Sign-On+Project+Home,"JOSSO, or Java Open Single Sign-On, is an open source J2EE-based SSO infrastructure aimed to provide a solution for centralized platform neutral user authentication.",1,10/23/15,http://planlodge.com/techconsume/recipientimages/empty-avatar.jpg129,JAT,Java,http://planlodge.com/techconsume/no-website.html,"JAT is a flexible Java base-framework which can be easily extended to improve projects start-up time. JAT allows to build Web applications (J2EE) or standalone application (server, batch, etc.). JAT supplies the main basic functionalities of any Java application, such as: * High Business Object abstraction * Integration facilities (provided for DBMS, LDAP and open to any software product) * Authentication and user privileges management * MVC pattern implementation (with privileges management and page flow control) * HTML layout structure management (header, footer, menu, etc.) * HTML dynamic contents and facilities (form, report, paging) * Logging feautures * Help on-line utility * High configuration of all described functionalities * Administration and configuration GUI",1,10/23/15,http://planlodge.com/techconsume/recipientimages/empty-avatar.jpg130,OpenXava,Java,http://www.openxava.org/,XML / Java Framework to develop J2EE business applications rapidly and easily. It is based in business components defined with XML. Feature rich and flexible since is used for years to create real business applications.,1,10/23/15,http://planlodge.com/techconsume/recipientimages/empty-avatar.jpg131,Click,Java,http://click.apache.org/,"Click is a J2EE web application framework created for commercial Java developers. Click Highlights * Very easy to learn * Component and Page Oriented design * Event base programming model * Automatic form validation * Page templating * Velocity page rendering * Superb error reporting * High performance The design philosophy behind Click is best summarized in the Swedish word lagom which translates to not too little or too much, but optimal.",1,10/23/15,http://planlodge.com/techconsume/recipientimages/empty-avatar.jpg132,ZK,Java,http://www.zkoss.org/,"ZK is an AJAX-based, event-driven, XUL-compliant, all Java framework for enabling Web applications to have the rich user experiences. With intuitive event-driven model, you represent your application in feature-rich XUL components, and manipulate these components by listening to events triggered by users, as simple as you did for years in desktop applications. No JavaScript. No replication of business logic at the clients. No proprietary components. No compilation. ZK works with existent frameworks and technologies, such as JSF and Portals, so the pace of adapting it is all under your control.",1,10/23/15,http://planlodge.com/techconsume/recipientimages/empty-avatar.jpg133,Caramba,Java,http://planlodge.com/techconsume/no-website.html,"The caramba framework is built from bottom to top with one main goal: creating Responsive, Rich Internet Applications. With the AJAX technology we could already achieve this, but it was hard to debug, error prone and time intensive to make it work. We are sure that simplicity can be achieved by following the event driven architecture: Caramba is 100% event driven, so very, very easy to use. Using Caramba makes it possible to make fancy, responsive web-applications without having to write a single line of JavaScript. You don't need to learn another language. Just the good old java syntax and JSP, that's all you need to know to get started.",1,10/23/15,http://planlodge.com/techconsume/recipientimages/empty-avatar.jpg134,wingS,Java,http://planlodge.com/techconsume/no-website.html,"wingS is a component based web framework resembling the Java Swing API with its MVC paradigm and event oriented design principles. It utilizes the models, events, and event listeners of Swing and organizes the components as a hierarchy of containers with layout managers. Version 2.0 comes with a completly rewritten rendering subsystem focusing on optimal stylability via CSS and new features like Drag & Drop support, context menus and Server-side code execution (AJAX). Selected features of wingS 2.0 are: * Comprehensive set of widgets including trees, tables, tabbed panes menus and more. * Highly flexible dynamic layout managers * Drag & Drop support * Component context menus and tooltips * Handling of browser back navigation * Improved styleability via CSS The distribution contains an extensive user documentation and various demo applications also available >>online. wingS is released under the LGPL licence. PermaLink",1,10/23/15,http://planlodge.com/techconsume/recipientimages/empty-avatar.jpg135,Helma,Java,http://helma.org/,Helma is an open source web application framework for fast and efficient scripting and serving of your websites and Internet applications.,1,10/23/15,http://planlodge.com/techconsume/recipientimages/empty-avatar.jpg136,Restlet,Java,http://restlet.com/,"Restlet is a framework that brings the simplicity and efficiency of the REST architectural style to Java developers. It is composed of two parts, a neutral API and a reference implementation (Noelios Restlet Engine). It supports all REST concepts (resource, representation, data, connector, components, etc.) and is suitable for both client and server REST applications. The server connectors provided are HTTP (via Mortbay's Jetty or an adapter Servlet) and the client connectors are HTTP, JDBC, and SMTP (via JavaMail).",1,10/23/15,http://planlodge.com/techconsume/recipientimages/empty-avatar.jpg