id,framework,language,link,description,popularity,dateAdded,images2,Backbone.js,Javascript,http://backbonejs.org/,"Backbone.js gives structure to web applications by providing models with key-value binding and custom events, collections with a rich API of enumerable functions, views with declarative event handling, and connects it all to your existing API over a RESTful JSON interface.",5,10/23/15,http://planlodge.com/techconsume/recipientimages/empty-avatar.jpg3,SproutCore,Javascript,http://sproutcore.com/,"SproutCore is an open-source framework for building blazingly fast, innovative user experiences on the web.",1,10/23/15,http://planlodge.com/techconsume/recipientimages/empty-avatar.jpg4,Sammy.js,Javascript,http://sammyjs.org/,Sammy.js is a tiny JavaScript framework developed to ease the pain and provide a basic structure for developing JavaScript applications.,1,10/23/15,http://planlodge.com/techconsume/recipientimages/empty-avatar.jpg5,Spine.js,Javascript,http://spinejs.com/,"Spine is a lightweight framework for building JavaScript web applications. Spine gives you an MVC structure and then gets out of your way, allowing you to concentrate on the fun stuff, building awesome web applications.",1,10/23/15,http://planlodge.com/techconsume/recipientimages/empty-avatar.jpg6,Cappuccino,Javascript,http://www.cappuccino-project.org/,"Cappuccino is a framework which makes it easy to create advanced web apps. With just a few lines of code you can have an app built with full undo and redo, truly amazing table views, drag and drop and every modern UI appearance and behaviour you might expect on the desktop.",1,10/23/15,http://planlodge.com/techconsume/recipientimages/empty-avatar.jpg7,Knockout.js,Javascript,http://knockoutjs.com/,"By encapsulating data and behavior into a view model, you get a clean, extensible foundation on which to build sophisticated UIs without getting lost in a tangle of event handlers and manual DOM updates.",1,10/23/15,http://planlodge.com/techconsume/recipientimages/empty-avatar.jpg8,Javascript MVC,Javascript,http://www.javascriptmvc.com/,It is the product of years of experience in the trenches developing medium to large JavaScript applications. It will help you build a quality application.,1,10/23/15,http://planlodge.com/techconsume/recipientimages/empty-avatar.jpg9,Google Web Toolkit,"Javascript, Java",http://www.gwtproject.org/,"GWT is used by many products at Google, including Google AdWords and Google Wallet. It's open source, completely free, and used by thousands of enthusiastic developers around the world.",1,10/23/15,http://planlodge.com/techconsume/recipientimages/empty-avatar.jpg10,Google Closure,Javascript,https://developers.google.com/closure/?hl=en,"The Closure Compiler compiles JavaScript into compact, high-performance code. The compiler removes dead code and rewrites and minimizes what's left so that it downloads and runs quickly. It also checks syntax, variable references, and types, and warns about common JavaScript pitfalls. ",1,10/23/15,http://planlodge.com/techconsume/recipientimages/empty-avatar.jpg11,Ember.js,Javascript,http://emberjs.com/,"Experience the future of the web platform today with Ember's components. Components allow you to create your own application-specific HTML tags, using Handlebars to describe their markup and JavaScript to implement custom behavior.",1,10/23/15,http://planlodge.com/techconsume/recipientimages/empty-avatar.jpg12,Angular.js,Javascript,https://angularjs.org/,AngularJS is a toolset for building the framework most suited to your application development. It is fully extensible and works well with other libraries. Every feature can be modified or replaced to suit your unique development workflow and feature needs.,1,10/23/15,http://planlodge.com/techconsume/recipientimages/empty-avatar.jpg13,Batman.js,Javascript,http://batmanjs.org/,"If you love Ruby on Rails, batman.js is the best, most familiar way to build rich web apps in CoffeeScript.",1,10/23/15,http://planlodge.com/techconsume/recipientimages/empty-avatar.jpg14,Asana Luna,Javascript,https://asana.com/luna,"A Luna application specifies a data model and a function from the model to the view (user interface), annotated with handler functions from user inputs to model mutations. From this, the Luna framework produces a functioning Web 2.0 application ? the client-side JavaScript, the server-side SQL, and everything in between ? complete with real-time bidirectional data synchronization.",1,10/23/15,http://planlodge.com/techconsume/recipientimages/empty-avatar.jpg15,qooxdoo,Javascript,http://qooxdoo.org/,"qooxdoo is a universal JavaScript framework with a coherent set of individual components and a powerful toolchain. It is open source under liberal licenses, and supported by one of the world's leading web hosts, 1&1.",1,10/23/15,http://planlodge.com/techconsume/recipientimages/empty-avatar.jpg16,ActiveJS,Javascript,https://github.com/aptana/activejs,ActiveJS is a JavaScript application framework that provides local and REST based data modeling and pure DOM view construction with back button and history support.,1,10/23/15,http://planlodge.com/techconsume/recipientimages/empty-avatar.jpg17,Eyeballs,Javascript,https://github.com/paulca/eyeballs.js/,"eyeballs.js can sit on top of an already implemented web app with a well thought out object model. It can also be used to build standalone javascript apps, backed by HTML5 local storage or something like CouchDB.",1,10/23/15,http://planlodge.com/techconsume/recipientimages/empty-avatar.jpg18,Choco,Javascript,https://chocolatejs.org/,Chocolate is an experimental full stack Node.js webapp framework built using Coffeescript.,1,10/23/15,http://planlodge.com/techconsume/recipientimages/empty-avatar.jpg19,Agility,Javascript,http://agilityjs.com/,"Agility.js is an MVC library for Javascript that lets you write maintainable and reusable browser code without the verbose or infrastructural overhead found in other MVC libraries. The goal is to enable developers to write web apps at least as quickly as with jQuery, while simplifying long-term maintainability through MVC objects.",1,10/23/15,http://planlodge.com/techconsume/recipientimages/empty-avatar.jpg20,Sencha ExtJS,Javascript,https://www.sencha.com/products/extjs/#overview,"Sencha Ext JS is the most comprehensive MVC/MVVM JavaScript framework for building feature-rich cross-platform web applications targeting desktops, tablets, and smartphones. Ext JS leverages HTML5 features on modern browsers while maintaining compatibility and functionality for legacy browsers.",1,10/23/15,http://planlodge.com/techconsume/recipientimages/empty-avatar.jpg21,Jamal,Javascript,https://github.com/adcloud/jamal/,"Jamal is a set of conventions and small javascript libraries to archieve a complete separation of html, css and javascript in your web application. Jamal is built on jQuery and inspired by MVC frameworks like Ruby on Rails, CakePHP and its derivatives.",1,10/23/15,http://planlodge.com/techconsume/recipientimages/empty-avatar.jpg22,PureMVC,Javascript,http://puremvc.org/,PureMVC is a lightweight framework for creating applications based upon the classic Model-View-Controller design meta-pattern. This is a JavaScript port of the AS3 reference implementation of the MultiCore Version. It supports modular programming through the use of Multiton Core actors.,1,10/23/15,http://planlodge.com/techconsume/recipientimages/empty-avatar.jpg23,TrimJunction,Javascript,https://code.google.com/p/trimpath/wiki/TrimJunction,"The open source Junction framework is a conventions-over-configuration, synchronizing web MVC framework for JavaScript.",1,10/23/15,http://planlodge.com/techconsume/recipientimages/empty-avatar.jpg24,CorMVC,Javascript,https://github.com/bennadel/CorMVC,"CorMVC is a jQuery-powered Model-View-Controller (MVC) framework that can aide in the development of single-page jQuery applications. It evolved out of my recent presentation, Building Single-Page Applications Using jQuery And ColdFusion, and will continue to evolve as I think more deeply about this type of application architecture.",1,10/23/15,http://planlodge.com/techconsume/recipientimages/empty-avatar.jpg25,Bootstrap,CSS,http://getbootstrap.com/,"Bootstrap easily and efficiently scales your websites and applications with a single code base, from phones to tablets to desktops with CSS media queries.",4,10/23/15,http://planlodge.com/techconsume/recipientimages/empty-avatar.jpg26,LESS,CSS,http://lesscss.org/,"Less is a CSS pre-processor, meaning that it extends the CSS language, adding features that allow variables, mixins, functions and many other techniques that allow you to make CSS that is more maintainable, themable and extendable.",1,10/23/15,http://planlodge.com/techconsume/recipientimages/empty-avatar.jpg27,Skeleton,CSS,http://getskeleton.com/,"You should use Skeleton if you're embarking on a smaller project or just don't feel like you need all the utility of larger frameworks. Skeleton only styles a handful of standard HTML elements and includes a grid, but that's often more than enough to get started. In fact, this site is built on Skeleton and has ~200 lines of custom CSS (half of which is the docking navigation).",1,10/23/15,http://planlodge.com/techconsume/recipientimages/empty-avatar.jpg28,Foundation,CSS,http://foundation.zurb.com/,"Foundation is a family of responsive front-end frameworks that make it easy to design beautiful responsive websites, apps and emails that look amazing on any device. Foundation is semantic, readable, flexible, and completely customizable. We?re constantly adding new resources and code snippets.",1,10/23/15,http://planlodge.com/techconsume/recipientimages/empty-avatar.jpg29,Gumby,CSS,http://www.gumbyframework.com/,"Gumby Framework is a flexible, responsive CSS Framework, Powered by SASS. Create rapid and logical page layout and app prototypes with a flexible and responsive grid system and UI kit.",1,10/23/15,http://planlodge.com/techconsume/recipientimages/empty-avatar.jpg30,Base,CSS,http://getbootstrap.com/2.3.2/base-css.html,Fundamental HTML elements styled and enhanced with extensible classes.,1,10/23/15,http://planlodge.com/techconsume/recipientimages/empty-avatar.jpg31,Compass,CSS,http://compass-style.org/,Compass is an open-source CSS authoring framework which uses the Sass stylesheet language to make writing stylesheets powerful and easy.,1,10/23/15,http://planlodge.com/techconsume/recipientimages/empty-avatar.jpg32,Columnal,CSS,http://www.columnal.com/,"Columnal makes responsive prototyping a little easier. It is 1140px wide, but since it is fluid, will respond to the width of most browsers. It is not recommended for production use, it is intended as a rapid prototyping tool only.",1,10/23/15,http://planlodge.com/techconsume/recipientimages/empty-avatar.jpg33,Profound,CSS,http://www.profoundgrid.com/,"A responsive grid system for fixed and fluid layouts. Built in SCSS, it gives you flexibility and full control.",1,10/23/15,http://planlodge.com/techconsume/recipientimages/empty-avatar.jpg34,Goldilocks,CSS,http://goldilocksapproach.com/,"The Goldilocks Approach uses a combination of Ems, Max-Width, Media Queries and Pattern Translations to consider just three states that allow your designs to be resolution independent.",1,10/23/15,http://planlodge.com/techconsume/recipientimages/empty-avatar.jpg35,InuitCSS,CSS,https://github.com/csswizardry/inuit.css/,"It is a Sass based, Object Oriented framework that is full of objects and abstractions. inuit.css provides little-to-no design which means no undoing things, no deleting CSS and no adhering to other peoples? design decisions.",1,10/23/15,http://planlodge.com/techconsume/recipientimages/empty-avatar.jpg36,Blueprint,CSS,http://www.blueprintcss.org/,"Blueprint is a CSS framework, which aims to cut down on your development time. It gives you a solid foundation to build your project on top of, with an easy-to-use grid, sensible typography, useful plugins, and even a stylesheet for printing.",1,10/23/15,http://planlodge.com/techconsume/recipientimages/empty-avatar.jpg37,YAML,CSS,http://www.yaml.de/,"A modular CSS framework for truly flexible, accessible and responsive websites",1,10/23/15,http://planlodge.com/techconsume/recipientimages/empty-avatar.jpg38,Gridlock,CSS,https://github.com/FormstoneClassic/Gridlock,A responsive CSS grid system. Part of the Formstone Library.,1,10/23/15,http://planlodge.com/techconsume/recipientimages/empty-avatar.jpg39,Amazium,CSS,http://www.amazium.co.uk/,"Amazium is built to do all the hard work of resizing your content using 4 media queries (1200px, 960px, 768px & < 767px)",1,10/23/15,http://planlodge.com/techconsume/recipientimages/empty-avatar.jpg40,34 Grid,CSS,http://34grid.com/,"34Grid is a Responsive Grid System based on "equally distributed columns" layout basis. 34Grid provides equally distributed columns for each row.""4Grid is a Responsive Grid System based on "equally distributed columns" layout basis. 34Grid provid""Grid is a Responsive Grid System based on "equally distr""rid is a Resp",1,10/23/15,http://planlodge.com/techconsume/recipientimages/empty-avatar.jpg41,Gridiculo.us,CSS,http://gridiculo.us/,A fully responsive grid boilerplate that takes you all the way from 1200px on down to 320px.,1,10/23/15,http://planlodge.com/techconsume/recipientimages/empty-avatar.jpg42,Ingrid,CSS,http://piira.se/projects/ingrid/,"Ingrid is a lightweight and fluid CSS layout system, whose main goal is to reduce the use of classes on individual units. Making it feel a bit less obtrusive and bit more fun to reflow for responsive layouts.",1,10/23/15,http://planlodge.com/techconsume/recipientimages/empty-avatar.jpg43,Kube,CSS,http://imperavi.com/kube/,"Kube is one of the world's most advanced and flexible frameworks. Kube helps you spend less time on routine tasks and more time creating amazing products. Focus on success, and Kube will cover the technology behind it.",1,10/23/15,http://planlodge.com/techconsume/recipientimages/empty-avatar.jpg44,Ivory,CSS,http://weice.in/ivory/,"IVORY Framework is 12 column fluid width grid. In general 12 column is dividable by 2, 3, 4, 6, 12 equal parts but our framework can also be dividable by 5 and 8 equal parts also.",1,10/23/15,http://planlodge.com/techconsume/recipientimages/empty-avatar.jpg45,Unsemantic,CSS,http://unsemantic.com/,"Unsemantic is a fluid grid system that is the successor to the 960 Grid System. It works in a similar way, but instead of being a set number of columns, it's entirely based on percentages.",1,10/23/15,http://planlodge.com/techconsume/recipientimages/empty-avatar.jpg46,Toast,CSS,https://daneden.github.io/Toast/,"Twelve columns. Six columns. Nine columns. As many columns as you want, in as many combinations as you want.",1,10/23/15,http://planlodge.com/techconsume/recipientimages/empty-avatar.jpg47,Sassaparilla,CSS,http://sass.fffunction.co/,"Sassaparilla is a fast way to start your responsive web design projects that harnesses the power of Sass and Compass. It comes with just enough to get you on your way, and no unnecessary extras, so you can spend less time deleting what you don?t need and more time building.",1,10/23/15,http://planlodge.com/techconsume/recipientimages/empty-avatar.jpg48,Lithium,PHP,http://li3.me/,"li3 is the first and only major PHP framework built from the ground up for PHP 5.3+, and the first to break ground into major new technologies, including bridging the gap between relational and non-relational databases through a single, unified API.",1,10/23/15,http://planlodge.com/techconsume/recipientimages/empty-avatar.jpg49,Laravel,PHP,http://laravel.com/,"Value elegance, simplicity, and readability? You?ll fit right in. Laravel is designed for people just like you. If you need help getting started, check out?Laracasts?and our?great documentation.",1,10/23/15,http://planlodge.com/techconsume/recipientimages/empty-avatar.jpg50,Aiki,PHP,http://aiki.softwaresea.com/Linux-software-download/aiki,"Aiki Framework?" is a flexible?PHP?+?MYSQL?(LAMP)?web application framework?that allows designers and programmers to easily create and work with existing content management systems from the web.""iki Framework?" is a flexible?PHP?+?MYSQL?(LAMP)?web application framework?that allows designers and programmers to easily create and work with existing content management system""ki Framework?" is a flexible?PHP?+?MYSQL?(LAMP)?web application framework?that allows designers and programmers to easily create and work with existing content man""i Framework?" is a flexible?PHP?+?MYSQL?(LAMP)?web application framework?that allows designers and programmers to easily create and work with existin"" Framework?" is a flexible?PHP?+?MYSQL?(LAMP)?web application framework?that allows designers and programmers to easily create and work ""Framework?" is a flexible?PHP?+?MYSQL?(LAMP)?web application framework?that allows designers and programmers to easily creat""ramework?" is a flexible?PHP?+?MYSQL?(LAMP)?web application framework?that allows designers and programmers to ea""amework?" is a flexible?PHP?+?MYSQL?(LAMP)?web application framework?that allows designers and programm""mework?" is a flexible?PHP?+?MYSQL?(LAMP)?web application framework?that allows designers and ""ework?" is a flexible?PHP?+?MYSQL?(LAMP)?web application framework?that allows designe""work?" is a flexible?PHP?+?MYSQL?(LAMP)?web application framework?that allows d""ork?" is a flexible?PHP?+?MYSQL?(LAMP)?web application framework?that all""rk?" is a flexible?PHP?+?MYSQL?(LAMP)?web application framework?that""k?" is a flexible?PHP?+?MYSQL?(LAMP)?web application framework?t""?" is a flexible?PHP?+?MYSQL?(LAMP)?web application framework""" is a flexible?PHP?+?MYSQL?(LAMP)?web application framewor"" is a flexible?PHP?+?MYSQL?(LAMP)?web application framewor",1,10/23/15,http://planlodge.com/techconsume/recipientimages/empty-avatar.jpg51,Apigility,PHP,https://apigility.org/,"Separating presentation logic from data provides the flexibility to support multiple client form factors, and future-proofs apps to allow behind-the-scenes change without breaking user interfaces. With Apigility, you can take the code that powers your business, and then API-enable it.",1,10/23/15,http://planlodge.com/techconsume/recipientimages/empty-avatar.jpg52,Ayoola,PHP,http://planlodge.com/techconsume/no-website.html,"Ayoola Framework was written in PHP, Javascript, HTML and CSS. It was designed so you may never need to learn any of those languages.",1,10/23/15,http://planlodge.com/techconsume/recipientimages/empty-avatar.jpg53,BansheePHP,PHP,http://www.banshee-php.org/,"Banshee is a PHP website framework, which aims at being secure, fast and easy to use. It has a?Model-View-Controller?architecture (XSLT?for the views). Although it was designed to use MySQL as the database, other database applications can be used as well with only little effort.",1,10/23/15,http://planlodge.com/techconsume/recipientimages/empty-avatar.jpg54,CakePHP,PHP,http://cakephp.org/,"CakePHP comes with built-in tools for input validation, CSRF protection, Form tampering protection, SQL injection prevention, and XSS prevention, helping you keep your application safe & secure.",1,10/21/15,http://planlodge.com/techconsume/recipientimages/empty-avatar.jpg55,CodeIgniter,PHP,http://www.codeigniter.com/,"CodeIgniter is not trying to be all things to all people. It is a lean MVC framework, with enough capabilities to improve your productivity, while providing for third-party addons/plugins for additional functionality.",1,10/23/15,http://planlodge.com/techconsume/recipientimages/empty-avatar.jpg56,Drupal,PHP,https://www.drupal.org/,Drupal helps you build everything from personal blogs to enterprise applications. Thousands of add-on modules and designs let you build any site you can imagine.,1,10/23/15,http://planlodge.com/techconsume/recipientimages/empty-avatar.jpg57,FuelPHP,PHP,http://fuelphp.com/,"FuelPHP is a MVC (Model-View-Controller) framework that was designed from the ground up to have full support for?HMVC?as part of its architecture. But we didn't stop there, we also added?ViewModels?(also known as?presentation models) into the mix which give you the option to add a powerful layer between the Controller and the View.",1,10/23/15,http://planlodge.com/techconsume/recipientimages/empty-avatar.jpg59,Hazaar MVC,PHP,http://www.hazaarmvc.com/,"A lot of thought has gone into making Hazaar MVC the fastest performing MVC framework for PHP by writing smart code that dynamically loads only what you need, when you need it.",1,10/23/15,http://planlodge.com/techconsume/recipientimages/empty-avatar.jpg60,Fat-Free,PHP,http://fatfreeframework.com/home,A powerful yet easy-to-use PHP micro-framework designed to help you build dynamic and robust web applications - fast!,1,10/23/15,http://planlodge.com/techconsume/recipientimages/empty-avatar.jpg61,ImpressPages,PHP,https://www.impresspages.org/,A new MVC engine based on globally recognized PHP components is under the hood so you can customize ImpressPages in no time. Write your own plugins and themes to suit your and customers? needs.?,1,10/23/15,http://planlodge.com/techconsume/recipientimages/empty-avatar.jpg62,INEK,PHP,http://planlodge.com/techconsume/no-website.html,"Inek Framework is designed around PEAR, using?HTML_Quickform, DB, Config, Log and Smarty",1,10/23/15,http://planlodge.com/techconsume/recipientimages/empty-avatar.jpg63,Joomla,PHP,http://framework.joomla.org/,"The Joomla! Framework is a new PHP framework for writing web and command line applications in PHP, without the features and corresponding overhead found in the Joomla! Content Management System (CMS). It provides a structurally sound foundation, which is easy to adapt and easy to extend.",1,10/23/15,http://planlodge.com/techconsume/recipientimages/empty-avatar.jpg65,Kajona,PHP,https://www.kajona.de/,"The framework to build and manage websites in no time.?Install?the system within a few minutes, choose one of the many?templates available?and start to?modify?the demo-contents according to your needs.",1,10/23/15,http://planlodge.com/techconsume/recipientimages/empty-avatar.jpg66,Kohana,PHP,https://kohanaframework.org/,This is an OOP framework that is extremely DRY. Everything is built using strict PHP 5 classes and objects.,1,10/23/15,http://planlodge.com/techconsume/recipientimages/empty-avatar.jpg67,Novius OS,PHP,https://github.com/novius-os/novius-os,"Create Once Publish Everywhere with Novius OS, a Cross-Channel Open Source CMS.",1,10/23/15,http://planlodge.com/techconsume/recipientimages/empty-avatar.jpg68,Nette,PHP,https://nette.org/en/,"Nette uses revolutionary technology that eliminates security holes and their misuse, such as?XSS,?CSRF, session hijacking, session fixation, etc.",1,10/23/15,http://planlodge.com/techconsume/recipientimages/empty-avatar.jpg69,Phalcon,PHP,https://phalconphp.com/en/,Its innovative architecture makes Phalcon the fastest PHP framework ever built!,1,10/23/15,http://planlodge.com/techconsume/recipientimages/empty-avatar.jpg70,PHPixie,PHP,http://phpixie.com/,PHPixie 3 supports organizing your project into bundles to make it easy to reuse your code in other projects. For example a user system that handles login and registration could be organized into a bundle and used in a different project.,1,10/23/15,http://planlodge.com/techconsume/recipientimages/empty-avatar.jpg71,PRADO,PHP,http://www.pradosoft.com/,PRADO is a component-based and event-driven programming framework for developing Web applications in PHP 5. PRADO stands for PHP Rapid Application Development Object-oriented.,1,10/20/15,http://planlodge.com/techconsume/recipientimages/empty-avatar.jpg72,ProcessWire,PHP,https://processwire.com/,"ProcessWire is a free PHP content management system and framework (open source CMS/CMF) built to save you time and work the way you do. Stop trying to bend other open source CMS platforms to your will ? ProcessWire provides simpler and stronger control over your pages, fields, templates and markup at any scale.",1,10/23/15,http://planlodge.com/techconsume/recipientimages/empty-avatar.jpg73,SilverStripe,PHP,http://www.silverstripe.org/software/framework/,SilverStripe Framework gives you the tools to create the web application you actually want to build without having to conform to the rules and constraints of other systems.,1,10/23/15,http://planlodge.com/techconsume/recipientimages/empty-avatar.jpg74,Silex,PHP,http://silex.sensiolabs.org/,Silex is a PHP microframework for PHP. It is built on the shoulders of Symfony2 and Pimple and also inspired by sinatra.,1,10/23/15,http://planlodge.com/techconsume/recipientimages/empty-avatar.jpg76,Symfony,PHP,https://symfony.com/,"Embracing and promoting professionalism, best practices, standardization and interoperability of applications.",6,10/23/15,http://planlodge.com/techconsume/recipientimages/empty-avatar.jpg77,TYPO3,PHP,http://flow.typo3.org/home,Flow is a web application platform enabling developers creating excellent web solutions and bring back the joy of coding.,1,10/23/15,http://planlodge.com/techconsume/recipientimages/empty-avatar.jpg78,XOOPS,PHP,http://xoops.org/,"XOOPS is a web application platform written in PHP for the MySQL database. Its object orientation makes it an ideal tool for developing small or large community websites, intra company and corporate portals, weblogs and much more. ",1,10/23/15,http://planlodge.com/techconsume/recipientimages/empty-avatar.jpg79,Yii,PHP,http://www.yiiframework.com/,"Yii comes with rich features: MVC, DAO/ActiveRecord, I18N/L10N, caching, authentication and role-based access control, scaffolding, testing, etc. It can reduce your development time significantly.",1,10/23/15,http://planlodge.com/techconsume/recipientimages/empty-avatar.jpg